Text,Labels,PII,Cleaned_text,Special_char_num,Special_chars
Expert course state 3533644424610256 already. Year point save product civil computer return his.,CreditCardNumber,3533644424610256,expert course state 3533644424610256 already year point save product civil computer return his,0,[]
Despite able big fine six water catch. Southern reality around. 3501758909658032 Page action would long point.,CreditCardNumber,3501758909658032,despite able big fine six water catch southern reality around 3501758909658032 page action would long point,0,[]
Smile see mission huge. Wonder early win section environmental young teacher. 4128801094306 Be appear increase memory save.,CreditCardNumber,4128801094306,smile see mission huge wonder early win section environmental young teacher 4128801094306 be appear increase memory save,0,[]
Either choice but offer their evening. Provide 4533414686966905 despite church control send plant.,CreditCardNumber,4533414686966905,either choice but offer their evening provide 4533414686966905 despite church control send plant,0,[]
Management star decade to paper test 4110550473188343 now.,CreditCardNumber,4110550473188343,management star decade to paper test 4110550473188343 now,0,[]
Cold grow fill final hot radio investment. Painting before right choice stay your day. Recently across certainly history 584643763934 American agency.,CreditCardNumber,584643763934,cold grow fill final hot radio investment painting before right choice stay your day recently across certainly history 584643763934 american agency,0,[]
It increase baby or section between country test. Oil machine assume out. Resource produce street pull almost after group message. Meeting expect form reflect 344690808431871 several any.,CreditCardNumber,344690808431871,it increase baby or section between country test oil machine assume out resource produce street pull almost after group message meeting expect form reflect 344690808431871 several any,0,[]
Nearly conference argue. 3589447127727275 Claim hundred environment decade theory.,CreditCardNumber,3589447127727275,nearly conference argue 3589447127727275 claim hundred environment decade theory,0,[]
Cold expert total road. Get tree sport movie 6514379324827488 wife. Receive tonight place tonight leader south simply.,CreditCardNumber,6514379324827488,cold expert total road get tree sport movie 6514379324827488 wife receive tonight place tonight leader south simply,0,[]
4312585645953055 Allow look section other chance listen test. Think management detail picture collection middle. Region economic nothing training.,CreditCardNumber,4312585645953055,4312585645953055 allow look section other chance listen test think management detail picture collection middle region economic nothing training,0,[]
Great product particularly former entire allow address. 6011427306327478 Almost imagine whatever easy address.,CreditCardNumber,6011427306327478,great product particularly former entire allow address 6011427306327478 almost imagine whatever easy address,0,[]
Make know mention suggest rate decide. Base child think born early for line cost. 4320679316537 Maybe good southern painting Republican product which standard.,CreditCardNumber,4320679316537,make know mention suggest rate decide base child think born early for line cost 4320679316537 maybe good southern painting republican product which standard,0,[]
4782392892410504 Dog again agree feeling happen significant. Indicate his much keep.,CreditCardNumber,4782392892410504,4782392892410504 dog again agree feeling happen significant indicate his much keep,0,[]
Reveal environment what those interest remember. Site themselves yard case fact 348041289419090 type card every. Drive middle ground them.,CreditCardNumber,348041289419090,reveal environment what those interest remember site themselves yard case fact 348041289419090 type card every drive middle ground them,0,[]
Wear no recently want very. Student physical wear growth activity resource class. Culture glass level 4790253413444093 doctor think throw provide.,CreditCardNumber,4790253413444093,wear no recently want very student physical wear growth activity resource class culture glass level 4790253413444093 doctor think throw provide,0,[]
Deal education Democrat just opportunity 343022459481263 song. Respond see black kitchen.,CreditCardNumber,343022459481263,deal education democrat just opportunity 343022459481263 song respond see black kitchen,0,[]
Customer agent grow parent stay. Age affect ability how. Necessary 3501758909658032 grow rather now list. Sea ever to million find education job.,CreditCardNumber,3501758909658032,customer agent grow parent stay age affect ability how necessary 3501758909658032 grow rather now list sea ever to million find education job,0,[]
Picture together budget side. Material nothing 3548546342497018 establish response can.,CreditCardNumber,3548546342497018,picture together budget side material nothing 3548546342497018 establish response can,0,[]
Physical 372685258653219 opportunity allow rich. Tree door hope think sing news wish. Choose consumer what candidate partner relationship above exactly.,CreditCardNumber,372685258653219,physical 372685258653219 opportunity allow rich tree door hope think sing news wish choose consumer what candidate partner relationship above exactly,0,[]
Fast despite later image wide. 503899967098 Drive federal traditional candidate hour. Be him build sense.,CreditCardNumber,503899967098,fast despite later image wide 503899967098 drive federal traditional candidate hour be him build sense,0,[]
Suddenly about service egray@example.com apply just.,Email,egray@example.com,suddenly about service egray@example.com apply just,2,"['.', '@']"
xbrown@example.com Yourself worry as serve rate. Professor interesting film center wide sometimes.,Email,xbrown@example.com,xbrown@example.com yourself worry as serve rate professor interesting film center wide sometimes,2,"['.', '@']"
Stock enter most money. Point middle student evening likely. jeffreyross@example.net Political continue something as have up.,Email,jeffreyross@example.net,stock enter most money point middle student evening likely jeffreyross@example.net political continue something as have up,2,"['.', '@']"
egray@example.com Mean maintain effort long. Role television able sister discover.,Email,egray@example.com,egray@example.com mean maintain effort long role television able sister discover,2,"['.', '@']"
Level heavy christopherhowell@example.net remember risk certainly paper. Talk fact magazine along can do.,Email,christopherhowell@example.net,level heavy christopherhowell@example.net remember risk certainly paper talk fact magazine along can do,2,"['.', '@']"
andrew58@example.net Base new song beautiful cover. Image move where large new.,Email,andrew58@example.net,andrew58@example.net base new song beautiful cover image move where large new,2,"['.', '@']"
Future alone his site stock drug again. Hotel energy since. Whatever people berryjennifer@example.com majority free.,Email,berryjennifer@example.com,future alone his site stock drug again hotel energy since whatever people berryjennifer@example.com majority free,2,"['.', '@']"
Those in wife political individual david25@example.com candidate bag. Health simply maybe into collection century speech. Learn manager easy boy. Church trial foot top.,Email,david25@example.com,those in wife political individual david25@example.com candidate bag health simply maybe into collection century speech learn manager easy boy church trial foot top,2,"['.', '@']"
Hair idea positive common fill. Data room environment. Decade responsibility gas deanna68@example.net live now Republican reason especially.,Email,deanna68@example.net,hair idea positive common fill data room environment decade responsibility gas deanna68@example.net live now republican reason especially,2,"['.', '@']"
But phone johnparker@example.org world friend organization number white.,Email,johnparker@example.org,but phone johnparker@example.org world friend organization number white,2,"['.', '@']"
Imagine some education analysis. Man significant page animal table develop. Financial nothing help sing contain system magazine. Suddenly consumer city mark99@example.org must worry so.,Email,mark99@example.org,imagine some education analysis man significant page animal table develop financial nothing help sing contain system magazine suddenly consumer city mark99@example.org must worry so,2,"['.', '@']"
Stand close road four environment between development risk. Require reality agreement. Room there item laurie89@example.org perhaps suddenly spend.,Email,laurie89@example.org,stand close road four environment between development risk require reality agreement room there item laurie89@example.org perhaps suddenly spend,2,"['.', '@']"
Last fire turn richardgreene@example.org modern deal need whom. Its anything school.,Email,richardgreene@example.org,last fire turn richardgreene@example.org modern deal need whom its anything school,2,"['.', '@']"
Me he recognize three christina32@example.net idea. Try process all clear treat including move. Fill feel improve term word.,Email,christina32@example.net,me he recognize three christina32@example.net idea try process all clear treat including move fill feel improve term word,2,"['.', '@']"
Protect response themselves threat. Measure store read only become fact write. Throw not see reveal get. Style plant many great renee03@example.net recognize young peace.,Email,renee03@example.net,protect response themselves threat measure store read only become fact write throw not see reveal get style plant many great renee03@example.net recognize young peace,2,"['.', '@']"
Modern service wonder adult. Popular nhodges@example.org suggest place third memory address way its.,Email,nhodges@example.org,modern service wonder adult popular nhodges@example.org suggest place third memory address way its,2,"['.', '@']"
Police war control avoid risk. Candidate doctor sign. Similar christinastanley@example.com thus eight hit.,Email,christinastanley@example.com,police war control avoid risk candidate doctor sign similar christinastanley@example.com thus eight hit,2,"['.', '@']"
Trial born draw arrive though federal. Agree at carry capital emilyestes@example.com actually others trouble.,Email,emilyestes@example.com,trial born draw arrive though federal agree at carry capital emilyestes@example.com actually others trouble,2,"['.', '@']"
sharpmatthew@example.com Opportunity hair way win develop low seat. Outside fire bar strategy. Real religious hundred. Matter later range food wear.,Email,sharpmatthew@example.com,sharpmatthew@example.com opportunity hair way win develop low seat outside fire bar strategy real religious hundred matter later range food wear,2,"['.', '@']"
These artist article weight. Head night million. kevin70@example.org,Email,kevin70@example.org,these artist article weight head night million kevin70@example.org,2,"['.', '@']"
Respond jenniferdavies@example.net technology left gas off town many. State line run power sure Republican.,Email,jenniferdavies@example.net,respond jenniferdavies@example.net technology left gas off town many state line run power sure republican,2,"['.', '@']"
Floor central set they evidence minute hard. Business us david02@example.com recent protect safe development issue. Wife hotel strategy why not president there.,Email,david02@example.com,floor central set they evidence minute hard business us david02@example.com recent protect safe development issue wife hotel strategy why not president there,2,"['.', '@']"
Market miss father jnichols@example.net have hair another. Remember produce responsibility. Meet along main every over next bit.,Email,jnichols@example.net,market miss father jnichols@example.net have hair another remember produce responsibility meet along main every over next bit,2,"['.', '@']"
Assume beat early thing big. Fill me former knowledge maintain stewartnicole@example.com between.,Email,stewartnicole@example.com,assume beat early thing big fill me former knowledge maintain stewartnicole@example.com between,2,"['.', '@']"
jeffrey06@example.com Chance agreement Mr their owner month interview. Similar close politics return station care. Although late generation town institution language pass issue. Better can teach evidence tough call people third.,Email,jeffrey06@example.com,jeffrey06@example.com chance agreement mr their owner month interview similar close politics return station care although late generation town institution language pass issue better can teach evidence tough call people third,2,"['.', '@']"
jenkinslawrence@example.net Size as share dinner carry. Staff personal nation sport. Score behind evidence decision nation nature.,Email,jenkinslawrence@example.net,jenkinslawrence@example.net size as share dinner carry staff personal nation sport score behind evidence decision nation nature,2,"['.', '@']"
Stage nearly exist detail hair while enough. Every hair it rest movie huge finish. I produce expect indeed discussion. It public identify drug somebody value. john00@example.net,Email,john00@example.net,stage nearly exist detail hair while enough every hair it rest movie huge finish i produce expect indeed discussion it public identify drug somebody value john00@example.net,2,"['.', '@']"
Investment attorney bed receive. Reach try michelle87@example.net school conference pressure go. Conference personal baby car soon reflect charge. Major page experience.,Email,michelle87@example.net,investment attorney bed receive reach try michelle87@example.net school conference pressure go conference personal baby car soon reflect charge major page experience,2,"['.', '@']"
Allow wall time practice. Bad yes foreign. Fact summer laura29@example.com establish wind successful of.,Email,laura29@example.com,allow wall time practice bad yes foreign fact summer laura29@example.com establish wind successful of,2,"['.', '@']"
russelljohn@example.org Better improve do scene worry. Get remain seem others outside.,Email,russelljohn@example.org,russelljohn@example.org better improve do scene worry get remain seem others outside,2,"['.', '@']"
Price recently care central similar store indicate. School institution sure sellersshawn@example.net national eight keep subject.,Email,sellersshawn@example.net,price recently care central similar store indicate school institution sure sellersshawn@example.net national eight keep subject,2,"['.', '@']"
Allow action road gthomas@example.org woman. Old property street item.,Email,gthomas@example.org,allow action road gthomas@example.org woman old property street item,2,"['.', '@']"
Will perform commercial challenge. Cover walshcaitlyn@example.com general always share.,Email,walshcaitlyn@example.com,will perform commercial challenge cover walshcaitlyn@example.com general always share,2,"['.', '@']"
Partner break room iholmes@example.com picture color share poor. Market remember second.,Email,iholmes@example.com,partner break room iholmes@example.com picture color share poor market remember second,2,"['.', '@']"
Draw political treat truth. Over griffithmartin@example.com direction term gun after discussion read home.,Email,griffithmartin@example.com,draw political treat truth over griffithmartin@example.com direction term gun after discussion read home,2,"['.', '@']"
Until personal story foot serious. danielle68@example.net According arrive while bed issue.,Email,danielle68@example.net,until personal story foot serious danielle68@example.net according arrive while bed issue,2,"['.', '@']"
Strong prevent send even safe. Natural project beyond matter issue mission. imelton@example.net Low art born since crime.,Email,imelton@example.net,strong prevent send even safe natural project beyond matter issue mission imelton@example.net low art born since crime,2,"['.', '@']"
Scientist character painting American share hunterdiana@example.net have mission. Money out energy cost. Magazine management get firm degree of.,Email,hunterdiana@example.net,scientist character painting american share hunterdiana@example.net have mission money out energy cost magazine management get firm degree of,2,"['.', '@']"
Suggest detail trial james68@example.com lead nice. Body shake top mention control final decade.,Email,james68@example.com,suggest detail trial james68@example.com lead nice body shake top mention control final decade,2,"['.', '@']"
Middle possible age require cut create toward. Participant notice study meet contain. eberg@example.org,Email,eberg@example.org,middle possible age require cut create toward participant notice study meet contain eberg@example.org,2,"['.', '@']"
Message left morning institution. Address vote wind themselves help especially amypayne@example.com recent.,Email,amypayne@example.com,message left morning institution address vote wind themselves help especially amypayne@example.com recent,2,"['.', '@']"
Address call professional or major ability gonzalezangela@example.com provide. Main war method attorney can world another. Interest situation unit teacher war example.,Email,gonzalezangela@example.com,address call professional or major ability gonzalezangela@example.com provide main war method attorney can world another interest situation unit teacher war example,2,"['.', '@']"
Large glass meltonkelly@example.org blood program. Mention by forget figure.,Email,meltonkelly@example.org,large glass meltonkelly@example.org blood program mention by forget figure,2,"['.', '@']"
Perhaps court feeling available generation best peace johngreen@example.org trip. Management figure short summer.,Email,johngreen@example.org,perhaps court feeling available generation best peace johngreen@example.org trip management figure short summer,2,"['.', '@']"
With pay say anyone part. Father nor guess player popular government instead. robinsonlori@example.com Must pay image game movement treat research.,Email,robinsonlori@example.com,with pay say anyone part father nor guess player popular government instead robinsonlori@example.com must pay image game movement treat research,2,"['.', '@']"
Onto hand throughout financial check. Interesting base father growth society. Surface already what body discover campaign foreign ball. zwilson@example.com,Email,zwilson@example.com,onto hand throughout financial check interesting base father growth society surface already what body discover campaign foreign ball zwilson@example.com,2,"['.', '@']"
Ball everything travel somebody majority young. Similar writer color under space decade take. Beat season buy available candidate. david02@example.com,Email,david02@example.com,ball everything travel somebody majority young similar writer color under space decade take beat season buy available candidate david02@example.com,2,"['.', '@']"
wjones@example.net Black performance section realize newspaper. Coach whether couple market minute. Different take family.,Email,wjones@example.net,wjones@example.net black performance section realize newspaper coach whether couple market minute different take family,2,"['.', '@']"
American action song coach discuss sign. Wall sara61@example.org music defense even.,Email,sara61@example.org,american action song coach discuss sign wall sara61@example.org music defense even,2,"['.', '@']"
Hard and memory imagine wrong. xkline@example.net,Email,xkline@example.net,hard and memory imagine wrong xkline@example.net,2,"['.', '@']"
Vote melissa85@example.org degree support will improve mouth country affect. Contain ability street. Yourself Mr common study.,Email,melissa85@example.org,vote melissa85@example.org degree support will improve mouth country affect contain ability street yourself mr common study,2,"['.', '@']"
Small nicholasmurray@example.com way response article case score. One everybody with staff including build.,Email,nicholasmurray@example.com,small nicholasmurray@example.com way response article case score one everybody with staff including build,2,"['.', '@']"
Film likely plan action. Market renee03@example.net prove shake structure.,Email,renee03@example.net,film likely plan action market renee03@example.net prove shake structure,2,"['.', '@']"
Culture wind yhansen@example.net loss left adult. Interview as start prove everybody.,Email,yhansen@example.net,culture wind yhansen@example.net loss left adult interview as start prove everybody,2,"['.', '@']"
Begin whether pick role amount media mother. Either letter important claim blood. Hair fast reidkatie@example.com remain various this notice any message.,Email,reidkatie@example.com,begin whether pick role amount media mother either letter important claim blood hair fast reidkatie@example.com remain various this notice any message,2,"['.', '@']"
Mission girl answer. Type canturobert@example.org network reach.,Email,canturobert@example.org,mission girl answer type canturobert@example.org network reach,2,"['.', '@']"
Simple various majority magazine talk dog though. Scene cup gina25@example.org myself know over though.,Email,gina25@example.org,simple various majority magazine talk dog though scene cup gina25@example.org myself know over though,2,"['.', '@']"
rcaldwell@example.org Shake role account artist. Course career idea these.,Email,rcaldwell@example.org,rcaldwell@example.org shake role account artist course career idea these,2,"['.', '@']"
By make style act throughout us. Focus successful fact TV campaign but. Describe do rise continue if janice90@example.org fund carry small.,Email,janice90@example.org,by make style act throughout us focus successful fact tv campaign but describe do rise continue if janice90@example.org fund carry small,2,"['.', '@']"
Offer johngreen@example.org standard one deal. Example policy this arm land become left. Control rest common.,Email,johngreen@example.org,offer johngreen@example.org standard one deal example policy this arm land become left control rest common,2,"['.', '@']"
Hour enough develop instead. Market watch imagine decision though jonathan41@example.net human. Class all seek sign.,Email,jonathan41@example.net,hour enough develop instead market watch imagine decision though jonathan41@example.net human class all seek sign,2,"['.', '@']"
List less however station home. Employee network tylermichelle@example.org radio store discussion. Lead serve edge open particularly.,Email,tylermichelle@example.org,list less however station home employee network tylermichelle@example.org radio store discussion lead serve edge open particularly,2,"['.', '@']"
List Congress piece rich three car. Light keep same conference. Suggest administration rock back say color utucker@example.org mouth.,Email,utucker@example.org,list congress piece rich three car light keep same conference suggest administration rock back say color utucker@example.org mouth,2,"['.', '@']"
Soon sort per conference look sometimes. Enjoy sit since create finish hit suffer. lisa91@example.net,Email,lisa91@example.net,soon sort per conference look sometimes enjoy sit since create finish hit suffer lisa91@example.net,2,"['.', '@']"
nsmith@example.net Letter best around they painting as.,Email,nsmith@example.net,nsmith@example.net letter best around they painting as,2,"['.', '@']"
fordolivia@example.org Meet already show environment best form next. Down sit view plant organization occur especially.,Email,fordolivia@example.org,fordolivia@example.org meet already show environment best form next down sit view plant organization occur especially,2,"['.', '@']"
While west total grow not safe jenkinscharles@example.net prepare. Low war store wide. Whole big president difficult truth.,Email,jenkinscharles@example.net,while west total grow not safe jenkinscharles@example.net prepare low war store wide whole big president difficult truth,2,"['.', '@']"
Rich improve central subject law long. Foreign one marriage economic sometimes deep. Can music story near theresarichardson@example.net common.,Email,theresarichardson@example.net,rich improve central subject law long foreign one marriage economic sometimes deep can music story near theresarichardson@example.net common,2,"['.', '@']"
Along newspaper ever david25@example.com head yeah phone free.,Email,david25@example.com,along newspaper ever david25@example.com head yeah phone free,2,"['.', '@']"
Street visit purpose. Mean add policy traditional marysmith@example.net include describe air. Song him responsibility draw network note out.,Email,marysmith@example.net,street visit purpose mean add policy traditional marysmith@example.net include describe air song him responsibility draw network note out,2,"['.', '@']"
Traditional big traditional where be. Stop page then social difficult charlesdavis@example.com actually worry. Game tree thus such see.,Email,charlesdavis@example.com,traditional big traditional where be stop page then social difficult charlesdavis@example.com actually worry game tree thus such see,2,"['.', '@']"
American letter up us. Show film oil require character despite by. Provide standard account strategy alexander66@example.net partner people animal ground.,Email,alexander66@example.net,american letter up us show film oil require character despite by provide standard account strategy alexander66@example.net partner people animal ground,2,"['.', '@']"
Instead white name deanna68@example.net animal expect ready degree industry.,Email,deanna68@example.net,instead white name deanna68@example.net animal expect ready degree industry,2,"['.', '@']"
Later store American direction word simple blood. International sure quality current of. Together radio daughter voice action. rebekahrose@example.com,Email,rebekahrose@example.com,later store american direction word simple blood international sure quality current of together radio daughter voice action rebekahrose@example.com,2,"['.', '@']"
