Text,Labels,PII,Cleaned_text,Special_char_num,Special_chars
System move seat. Miss Julie Riley Do indicate citizen seven way.,Name,Miss Julie Riley,system move seat miss julie riley do indicate citizen seven way,0,[]
Arrive seem skill apply and ground. Produce really structure whole Barron include some bar.,Name,Barron,arrive seem skill apply and ground produce really structure whole barron include some bar,0,[]
Team those drop Alison Jones wall heavy thing.,Name,Alison Jones,team those drop alison jones wall heavy thing,0,[]
Bag usually trial this instead. Or operation save former behind. Author system story night. Final newspaper offer according particularly Aguirre effort.,Name,Aguirre,bag usually trial this instead or operation save former behind author system story night final newspaper offer according particularly aguirre effort,0,[]
Fund lead national account top ahead threat. Adult accept return Amy attention attention traditional woman.,Name,Amy,fund lead national account top ahead threat adult accept return amy attention attention traditional woman,0,[]
Project TV surface despite today. Law Jennings travel part.,Name,Jennings,project tv surface despite today law jennings travel part,0,[]
Find Larsen generation key measure.,Name,Larsen,find larsen generation key measure,0,[]
Green structure enough feeling Clements peace hand. Article thought pull quickly book how bring himself. Voice interview picture down ahead college leg.,Name,Clements,green structure enough feeling clements peace hand article thought pull quickly book how bring himself voice interview picture down ahead college leg,0,[]
Style more north put news Madeline institution.,Name,Madeline,style more north put news madeline institution,0,[]
Six response whatever difficult difficult Sarah Weber bank medical. Agency address off rule society program bag perhaps.,Name,Sarah Weber,six response whatever difficult difficult sarah weber bank medical agency address off rule society program bag perhaps,0,[]
Research language stock home. Social land road discussion. Stuff five west year admit kind poor business. Rowland,Name,Rowland,research language stock home social land road discussion stuff five west year admit kind poor business rowland,0,[]
Represent or stuff Levi Cardenas radio southern just. Pull material event likely. Of provide situation alone box.,Name,Levi Cardenas,represent or stuff levi cardenas radio southern just pull material event likely of provide situation alone box,0,[]
Shoulder assume popular. Blood dream although prove bill meeting Roberts road.,Name,Roberts,shoulder assume popular blood dream although prove bill meeting roberts road,0,[]
Provide Mcdonald contain magazine along president about. Move area boy. Put marriage media ask establish. Will ago apply cup money.,Name,Mcdonald,provide mcdonald contain magazine along president about move area boy put marriage media ask establish will ago apply cup money,0,[]
Somebody push person could notice Rowland result. Oil now fear give special suddenly.,Name,Rowland,somebody push person could notice rowland result oil now fear give special suddenly,0,[]
Half manage like truth stay common party. Law game such person we. Tax item beat Kathryn realize.,Name,Kathryn,half manage like truth stay common party law game such person we tax item beat kathryn realize,0,[]
Whether shake any Democrat money. Capital understand somebody public would. Fox Too glass write north simply. Across style involve large make be natural.,Name,Fox,whether shake any democrat money capital understand somebody public would fox too glass write north simply across style involve large make be natural,0,[]
Kitchen history example my Michael develop. Relate knowledge manager reach resource choose carry.,Name,Michael,kitchen history example my michael develop relate knowledge manager reach resource choose carry,0,[]
Somebody never commercial respond party. Voice Houston next skill hair happy.,Name,Houston,somebody never commercial respond party voice houston next skill hair happy,0,[]
Husband scientist next his top institution. Send suffer left protect Gonzalez American they realize.,Name,Gonzalez,husband scientist next his top institution send suffer left protect gonzalez american they realize,0,[]
Series majority treatment. Certainly top image explain thank pull Patricia Mora value. Start this friend lawyer.,Name,Patricia Mora,series majority treatment certainly top image explain thank pull patricia mora value start this friend lawyer,0,[]
Mary Hayes Share body available stage leader several. Loss very big section any. Other performance blood amount never.,Name,Mary Hayes,mary hayes share body available stage leader several loss very big section any other performance blood amount never,0,[]
Leader state prove such south goal authority. Heavy baby media outside hot society break. Especially thing federal. Perez,Name,Perez,leader state prove such south goal authority heavy baby media outside hot society break especially thing federal perez,0,[]
Worry hotel Miss Julie Riley build wind these nothing good very. Pressure partner operation education. Good use owner voice pattern fund identify.,Name,Miss Julie Riley,worry hotel miss julie riley build wind these nothing good very pressure partner operation education good use owner voice pattern fund identify,0,[]
Head wonder newspaper whose case popular true. Lisa Spend next start spend better task worker.,Name,Lisa,head wonder newspaper whose case popular true lisa spend next start spend better task worker,0,[]
Especially allow discuss sit lot true. Boy politics despite entire forget sign international popular. Five professional early Ronald cut already race.,Name,Ronald,especially allow discuss sit lot true boy politics despite entire forget sign international popular five professional early ronald cut already race,0,[]
Her approach lose. Though commercial Kevin Blake return voice. Control industry several.,Name,Kevin Blake,her approach lose though commercial kevin blake return voice control industry several,0,[]
Society number relationship amount. Mind space indeed Gary gas forget policy.,Name,Gary,society number relationship amount mind space indeed gary gas forget policy,0,[]
Jennifer Lewis Else sing agent sense. Could environmental those.,Name,Jennifer Lewis,jennifer lewis else sing agent sense could environmental those,0,[]
Risk effort believe myself. Henry,Name,Henry,risk effort believe myself henry,0,[]
Standard soldier even trial apply. Some market safe impact fly. Sanders Seven without project.,Name,Sanders,standard soldier even trial apply some market safe impact fly sanders seven without project,0,[]
Describe Kevin product foot child player support four. Enjoy production eat.,Name,Kevin,describe kevin product foot child player support four enjoy production eat,0,[]
Wrong price southern trial politics task apply free. Ross Activity prevent peace six author value.,Name,Ross,wrong price southern trial politics task apply free ross activity prevent peace six author value,0,[]
Street go authority book gun sound. Issue something study by rather east eye. Cox Training fund win feel camera although character.,Name,Cox,street go authority book gun sound issue something study by rather east eye cox training fund win feel camera although character,0,[]
Measure fund realize increase research eye Lee news. Speak television local western. Under entire conference serious today.,Name,Lee,measure fund realize increase research eye lee news speak television local western under entire conference serious today,0,[]
Various practice training open west success wife. Night indeed involve society public air. Opportunity off include speak long degree. Amy,Name,Amy,various practice training open west success wife night indeed involve society public air opportunity off include speak long degree amy,0,[]
Chair record decide. Medical report many whole woman its reveal. Store rock April Freeman stand decide ever against. Particular right accept policy effort good bank role.,Name,April Freeman,chair record decide medical report many whole woman its reveal store rock april freeman stand decide ever against particular right accept policy effort good bank role,0,[]
Mission security interview agreement mean cup. Manage poor even then by billion Michael Boyd type.,Name,Michael Boyd,mission security interview agreement mean cup manage poor even then by billion michael boyd type,0,[]
Davenport Choice she describe weight service development. Old state marriage do.,Name,Davenport,davenport choice she describe weight service development old state marriage do,0,[]
Draw bank treat many always it first both. Kid long four a whose contain hundred. Difference similar Brian Ortiz imagine daughter.,Name,Brian Ortiz,draw bank treat many always it first both kid long four a whose contain hundred difference similar brian ortiz imagine daughter,0,[]
Decide four serious fast grow leave serious. Taylor Carr Figure experience go she open easy chance. Member alone trip one president on head.,Name,Taylor Carr,decide four serious fast grow leave serious taylor carr figure experience go she open easy chance member alone trip one president on head,0,[]
Gray Laugh sometimes include politics church. Able hand become natural strategy group ground.,Name,Gray,gray laugh sometimes include politics church able hand become natural strategy group ground,0,[]
Method economic subject increase hundred material. One return resource Dr. Theodore Mcdaniel they fall enough. Director fight country same suffer majority scene.,Name,Dr. Theodore Mcdaniel,method economic subject increase hundred material one return resource dr theodore mcdaniel they fall enough director fight country same suffer majority scene,0,[]
Hot here maintain mouth. Threat it Fleming its worry many.,Name,Fleming,hot here maintain mouth threat it fleming its worry many,0,[]
Drug trouble open ability open draw statement story. Space food fear performance company. Guy before cover civil both have Cain article.,Name,Cain,drug trouble open ability open draw statement story space food fear performance company guy before cover civil both have cain article,0,[]
Create off majority yes draw. Soon agree those let apply true. Environment pull beyond cultural administration themselves Davis you.,Name,Davis,create off majority yes draw soon agree those let apply true environment pull beyond cultural administration themselves davis you,0,[]
Box brother partner happy environmental. Second make Smith another ask expert cost floor executive. Society could tax likely image tree.,Name,Smith,box brother partner happy environmental second make smith another ask expert cost floor executive society could tax likely image tree,0,[]
Body over Wilson way that to surface forget. Amount film theory white us support play act. Public for anything yard role travel. Democrat throw campaign apply already page reduce.,Name,Wilson,body over wilson way that to surface forget amount film theory white us support play act public for anything yard role travel democrat throw campaign apply already page reduce,0,[]
Almost assume star Morgan point.,Name,Morgan,almost assume star morgan point,0,[]
High herself Joanne meeting evening suggest song small. Church man choose through reason east.,Name,Joanne,high herself joanne meeting evening suggest song small church man choose through reason east,0,[]
Relationship case along for without home buy. Card Mary Hayes my thus audience police. Outside large court employee.,Name,Mary Hayes,relationship case along for without home buy card mary hayes my thus audience police outside large court employee,0,[]
Aguirre Smile the not country feel purpose head list. Industry manage growth middle writer. Experience officer energy.,Name,Aguirre,aguirre smile the not country feel purpose head list industry manage growth middle writer experience officer energy,0,[]
Worry policy during lay sister first third. Create suggest concern up simple watch. Piece push successful. Rise build Ryan investment control single.,Name,Ryan,worry policy during lay sister first third create suggest concern up simple watch piece push successful rise build ryan investment control single,0,[]
Name across some Natalie Smith sea indicate already. Hold officer air ever teacher avoid.,Name,Natalie Smith,name across some natalie smith sea indicate already hold officer air ever teacher avoid,0,[]
High else yourself huge miss likely Rebecca Hughes activity son. Lawyer will thank this of impact community. Instead property coach major tree leader court.,Name,Rebecca Hughes,high else yourself huge miss likely rebecca hughes activity son lawyer will thank this of impact community instead property coach major tree leader court,0,[]
Glass near establish amount firm. Kaufman Little provide himself.,Name,Kaufman,glass near establish amount firm kaufman little provide himself,0,[]
Focus try operation baby partner region TV. Free in available free amount ever. Increase here mouth Michael focus television.,Name,Michael,focus try operation baby partner region tv free in available free amount ever increase here mouth michael focus television,0,[]
Democrat rich west foreign buy poor first. Rock including community Michael edge. Between one light hope. This set into provide project.,Name,Michael,democrat rich west foreign buy poor first rock including community michael edge between one light hope this set into provide project,0,[]
Eight local create million Rodney Mata must follow individual. Never smile material affect.,Name,Rodney Mata,eight local create million rodney mata must follow individual never smile material affect,0,[]
Grow offer measure nation suddenly minute figure although. Decide mind go system Nicholas give.,Name,Nicholas,grow offer measure nation suddenly minute figure although decide mind go system nicholas give,0,[]
New though design west share compare author. Wanda Short lot owner fund accept someone.,Name,Wanda,new though design west share compare author wanda short lot owner fund accept someone,0,[]
Wonder technology marriage party customer address society. Current land interesting account medical difficult. Miss Julie Riley,Name,Miss Julie Riley,wonder technology marriage party customer address society current land interesting account medical difficult miss julie riley,0,[]
One rise resource power perform area hand. Price conference exactly later lead Mr. Lauren Burch,Name,Lauren Burch,one rise resource power perform area hand price conference exactly later lead mr lauren burch,0,[]
Recent say tax. Catch image Joanne foreign toward. May kitchen institution nature toward.,Name,Joanne,recent say tax catch image joanne foreign toward may kitchen institution nature toward,0,[]
Offer letter side. Exist light staff guy. He writer computer necessary Tucker throughout.,Name,Tucker,offer letter side exist light staff guy he writer computer necessary tucker throughout,0,[]
Site live reduce Stephanie yourself teacher.,Name,Stephanie,site live reduce stephanie yourself teacher,0,[]
Wall level body small difficult. Field next east Kaufman in civil drop.,Name,Kaufman,wall level body small difficult field next east kaufman in civil drop,0,[]
Fire argue line. Support near also Wanda woman foreign purpose.,Name,Wanda,fire argue line support near also wanda woman foreign purpose,0,[]
Source suffer good goal avoid compare. That area Amber Anderson wait.,Name,Amber Anderson,source suffer good goal avoid compare that area amber anderson wait,0,[]
Joshua King Agency father nation tax. Notice party choice decide add run visit media.,Name,Joshua King,joshua king agency father nation tax notice party choice decide add run visit media,0,[]
Inside inside level perhaps provide garden. Seven science Wayne hope course enter. Station win nothing if above.,Name,Wayne,inside inside level perhaps provide garden seven science wayne hope course enter station win nothing if above,0,[]
Few party ten pattern set party. Until Reed TV dream south road.,Name,Reed,few party ten pattern set party until reed tv dream south road,0,[]
Hundred same thousand American friend own. Off while chance near boy your senior. Richard Pena Today which begin type law early. Three sound summer book allow ready health.,Name,Richard Pena,hundred same thousand american friend own off while chance near boy your senior richard pena today which begin type law early three sound summer book allow ready health,0,[]
Keep usually community fill plant concern task all. Follow notice Holly Gentry society necessary later.,Name,Holly Gentry,keep usually community fill plant concern task all follow notice holly gentry society necessary later,0,[]
Help house near without involve woman. Goal protect military development Jennifer Lewis concern.,Name,Jennifer Lewis,help house near without involve woman goal protect military development jennifer lewis concern,0,[]
President base old guess case Bailey rule build test. Son husband form once car. Later part during memory detail exactly daughter. Child leader between help wish interest.,Name,Bailey,president base old guess case bailey rule build test son husband form once car later part during memory detail exactly daughter child leader between help wish interest,0,[]
Light magazine life big charge Rachel southern. Turn answer mean somebody early stuff.,Name,Rachel,light magazine life big charge rachel southern turn answer mean somebody early stuff,0,[]
Strategy family per discover run fill she. Knowledge improve per when. Strong indeed meet Brian Ortiz partner different.,Name,Brian Ortiz,strategy family per discover run fill she knowledge improve per when strong indeed meet brian ortiz partner different,0,[]
Region support future Rose black.,Name,Rose,region support future rose black,0,[]
Attorney call manager Ronald either meet war study. Keep production perform without often bad budget nice.,Name,Ronald,attorney call manager ronald either meet war study keep production perform without often bad budget nice,0,[]
Wear phone inside floor medical often Johnson purpose. Art officer indeed rock. Best sport resource score under whom.,Name,Johnson,wear phone inside floor medical often johnson purpose art officer indeed rock best sport resource score under whom,0,[]
Fear light window energy hospital generation. Front who act identify government Daniels perhaps.,Name,Daniels,fear light window energy hospital generation front who act identify government daniels perhaps,0,[]
Poor water thought finally. Guess government price civil ten affect. They Mary Hayes service skin always old.,Name,Mary Hayes,poor water thought finally guess government price civil ten affect they mary hayes service skin always old,0,[]
Fast then buy race its. Inside great Johnson across camera performance trade risk.,Name,Johnson,fast then buy race its inside great johnson across camera performance trade risk,0,[]
War page wall own federal vote. Decide note fast team Davis poor contain. Agent standard knowledge record.,Name,Davis,war page wall own federal vote decide note fast team davis poor contain agent standard knowledge record,0,[]
Peace produce various look wind eight. Great wind Amber Anderson arrive difference none people cut agree.,Name,Amber Anderson,peace produce various look wind eight great wind amber anderson arrive difference none people cut agree,0,[]
Parent talk determine production. Democrat cell Edward boy better wrong.,Name,Edward,parent talk determine production democrat cell edward boy better wrong,0,[]
Her use Rachel compare past enter. Top develop cause quickly.,Name,Rachel,her use rachel compare past enter top develop cause quickly,0,[]
Floor next Patricia Mora argue pass. Father guy cut when time everyone all.,Name,Patricia Mora,floor next patricia mora argue pass father guy cut when time everyone all,0,[]
Here movement actually fight present collection guess. But action daughter class. Hope Robles along hundred plan most them recognize.,Name,Robles,here movement actually fight present collection guess but action daughter class hope robles along hundred plan most them recognize,0,[]
Himself enjoy avoid. Lay develop break catch Adkins truth those face idea. Seven person pick card vote.,Name,Adkins,himself enjoy avoid lay develop break catch adkins truth those face idea seven person pick card vote,0,[]
Military rule popular indeed and never Rodney Mata eye.,Name,Rodney Mata,military rule popular indeed and never rodney mata eye,0,[]
Clearly magazine simple Joseph join. Chance concern become science picture.,Name,Joseph,clearly magazine simple joseph join chance concern become science picture,0,[]
Participant Robert Castro billion trial any dream two. Matter baby floor thought send.,Name,Robert Castro,participant robert castro billion trial any dream two matter baby floor thought send,0,[]
Class line name later card card. Knowledge decide situation area practice strong. Tonight social industry spring nearly process. Robinson,Name,Robinson,class line name later card card knowledge decide situation area practice strong tonight social industry spring nearly process robinson,0,[]
Pick appear baby Harris charge nature training. Couple kid generation nor responsibility possible. Happy gun a.,Name,Harris,pick appear baby harris charge nature training couple kid generation nor responsibility possible happy gun a,0,[]
Father election center ten. Morgan Contain end structure modern serious dog lay. Radio author race public.,Name,Morgan,father election center ten morgan contain end structure modern serious dog lay radio author race public,0,[]
Expert course state Jamie Martin already. Year point save product civil computer return his.,Name,Jamie Martin,expert course state jamie martin already year point save product civil computer return his,0,[]
Despite able big fine six water catch. Soto Southern reality around. Page action would long point.,Name,Soto,despite able big fine six water catch soto southern reality around page action would long point,0,[]
Smile see mission huge. Wonder early win section environmental young teacher. Be appear increase memory save. Brian Schaefer,Name,Brian Schaefer,smile see mission huge wonder early win section environmental young teacher be appear increase memory save brian schaefer,0,[]
Hanson Either choice but offer their evening. Provide despite church control send plant.,Name,Hanson,hanson either choice but offer their evening provide despite church control send plant,0,[]
Management star decade to paper Kimberly test now.,Name,Kimberly,management star decade to paper kimberly test now,0,[]
Cold grow fill final hot radio investment. Painting before right choice stay your day. Recently across certainly history Steven American agency.,Name,Steven,cold grow fill final hot radio investment painting before right choice stay your day recently across certainly history steven american agency,0,[]
It increase baby or section between country test. Oil machine assume out. Resource produce street pull almost after Marquez group message. Meeting expect form reflect several any.,Name,Marquez,it increase baby or section between country test oil machine assume out resource produce street pull almost after marquez group message meeting expect form reflect several any,0,[]
Nearly conference argue. Claim hundred environment decade Barrera theory.,Name,Barrera,nearly conference argue claim hundred environment decade barrera theory,0,[]
Cold expert total road. Get tree sport Robert Castro movie wife. Receive tonight place tonight leader south simply.,Name,Robert Castro,cold expert total road get tree sport robert castro movie wife receive tonight place tonight leader south simply,0,[]
Allow look section other chance Joseph Stanton listen test. Think management detail picture collection middle. Region economic nothing training.,Name,Joseph Stanton,allow look section other chance joseph stanton listen test think management detail picture collection middle region economic nothing training,0,[]
Great product particularly former entire Heather Randolph allow address. Almost imagine whatever easy address.,Name,Heather Randolph,great product particularly former entire heather randolph allow address almost imagine whatever easy address,0,[]
Make know mention suggest rate decide. Base child think born early for line cost. Maybe good southern Ellis painting Republican product which standard.,Name,Ellis,make know mention suggest rate decide base child think born early for line cost maybe good southern ellis painting republican product which standard,0,[]
Cynthia Dog again agree feeling happen significant. Indicate his much keep.,Name,Cynthia,cynthia dog again agree feeling happen significant indicate his much keep,0,[]
Reveal environment Madeline what those interest remember. Site themselves yard case fact type card every. Drive middle ground them.,Name,Madeline,reveal environment madeline what those interest remember site themselves yard case fact type card every drive middle ground them,0,[]
Wear no recently want very. Student physical wear growth Patricia Mora activity resource class. Culture glass level doctor think throw provide.,Name,Patricia Mora,wear no recently want very student physical wear growth patricia mora activity resource class culture glass level doctor think throw provide,0,[]
Deal education Democrat just opportunity Houston song. Respond see black kitchen.,Name,Houston,deal education democrat just opportunity houston song respond see black kitchen,0,[]
Customer agent grow parent stay. Age affect ability how. Necessary grow rather now list. Sea ever to Jennifer Lewis million find education job.,Name,Jennifer Lewis,customer agent grow parent stay age affect ability how necessary grow rather now list sea ever to jennifer lewis million find education job,0,[]
