Text,Labels,PII,Cleaned_text,Special_char_num,Special_chars
Memory spend fish animal minute assume gun. Down red 362-VDH table left the very drop.,Plates,362-VDH,memory spend fish animal minute assume gun down red 362-vdh table left the very drop,1,['-']
Together 522 GRQ only figure establish. Picture whatever Congress system wind seat professor state. Guess purpose southern give during born half.,Plates,522 GRQ,together 522 grq only figure establish picture whatever congress system wind seat professor state guess purpose southern give during born half,0,[]
None finish wind certain 530-OES tend along. Stay defense everybody provide. Back ground find their know face. Ten happy gun hear.,Plates,530-OES,none finish wind certain 530-oes tend along stay defense everybody provide back ground find their know face ten happy gun hear,1,['-']
Beyond try affect 342 1998 outside boy air. Degree another who. Garden hundred standard return explain.,Plates,342 1998,beyond try affect 342 1998 outside boy air degree another who garden hundred standard return explain,0,[]
Rock hit treat human. Poor speech past HM7 B5P actually listen.,Plates,HM7 B5P,rock hit treat human poor speech past hm7 b5p actually listen,0,[]
Stage develop person 659O letter especially. Window your inside bit wide girl news.,Plates,659O,stage develop person 659o letter especially window your inside bit wide girl news,0,[]
Let person strategy physical try dark close. Pm travel boy raise receive late special. 892R7,Plates,892R7,let person strategy physical try dark close pm travel boy raise receive late special 892r7,0,[]
716 8PU Matter choice style message mind drug career. Surface leg only feeling. Song range may computer. Deal fire wall when must their result.,Plates,716 8PU,716 8pu matter choice style message mind drug career surface leg only feeling song range may computer deal fire wall when must their result,0,[]
201-PNRV Great art moment enough new suggest final.,Plates,201-PNRV,201-pnrv great art moment enough new suggest final,1,['-']
Congress thousand if computer attention with. Hundred both usually 99NV1 affect democratic.,Plates,99NV1,congress thousand if computer attention with hundred both usually 99nv1 affect democratic,0,[]
Second rule far free paper road hour. FF 3434 One particularly yes society. Performance bag maybe mean.,Plates,FF 3434,second rule far free paper road hour ff 3434 one particularly yes society performance bag maybe mean,0,[]
6WU05 Realize participant energy interest fish value job pass.,Plates,6WU05,6wu05 realize participant energy interest fish value job pass,0,[]
Along CZR 622 doctor wish.,Plates,CZR 622,along czr 622 doctor wish,0,[]
Debate experience everything interview main them. Official politics our responsibility ZWQ 873 lead. Detail who message then.,Plates,ZWQ 873,debate experience everything interview main them official politics our responsibility zwq 873 lead detail who message then,0,[]
Media administration never line only lose. 0-56455H Certain southern draw picture operation rest benefit alone. Certain already nothing.,Plates,0-56455H,media administration never line only lose 0-56455h certain southern draw picture operation rest benefit alone certain already nothing,1,['-']
Parent feel book standard. 370 0WH Development add appear speak past.,Plates,370 0WH,parent feel book standard 370 0wh development add appear speak past,0,[]
Community yet not sometimes often. Boy X05-YSG citizen decade toward religious.,Plates,X05-YSG,community yet not sometimes often boy x05-ysg citizen decade toward religious,1,['-']
Tonight radio five 65I433 situation week hit course. Direction season just key gas soon.,Plates,65I433,tonight radio five 65i433 situation week hit course direction season just key gas soon,0,[]
Accept walk avoid little medical sense degree. Level JM-1378 buy note ahead next cost clearly style.,Plates,JM-1378,accept walk avoid little medical sense degree level jm-1378 buy note ahead next cost clearly style,1,['-']
Pressure describe thousand ground their budget. Common KBY6463 project deep. Accept rule area what former professional technology.,Plates,KBY6463,pressure describe thousand ground their budget common kby6463 project deep accept rule area what former professional technology,0,[]
Reason opportunity 925 4298 draw natural. Area surface next paper on two today. Official yeah successful.,Plates,925 4298,reason opportunity 925 4298 draw natural area surface next paper on two today official yeah successful,0,[]
Doctor color BEK 053 sell. Carry day impact car serious.,Plates,BEK 053,doctor color bek 053 sell carry day impact car serious,0,[]
Skin bit 57X977 bank realize. Statement friend others thus wind. Thought term animal animal could party plant.,Plates,57X977,skin bit 57x977 bank realize statement friend others thus wind thought term animal animal could party plant,0,[]
Officer mission around get rest fine level. Others generation last when successful 8YV48 send every.,Plates,8YV48,officer mission around get rest fine level others generation last when successful 8yv48 send every,0,[]
First safe XEN 980 bank everybody behind draw.,Plates,XEN 980,first safe xen 980 bank everybody behind draw,0,[]
Especially do game us put page exist least. Million figure material 352 NIG fill shake fire.,Plates,352 NIG,especially do game us put page exist least million figure material 352 nig fill shake fire,0,[]
Down cause southern example. Head sit without answer do. 173-WHE,Plates,173-WHE,down cause southern example head sit without answer do 173-whe,1,['-']
Art along challenge however arrive back receive detail. 1DM46 Look summer day last since miss participant.,Plates,1DM46,art along challenge however arrive back receive detail 1dm46 look summer day last since miss participant,0,[]
Offer either change although 768H treat. Alone top friend dream environment reduce.,Plates,768H,offer either change although 768h treat alone top friend dream environment reduce,0,[]
Weight BQY 333 happen source indicate reach because information clearly. Big ground know similar.,Plates,BQY 333,weight bqy 333 happen source indicate reach because information clearly big ground know similar,0,[]
86-I289 Head pretty worker. Huge partner food green. Already set four read.,Plates,86-I289,86-i289 head pretty worker huge partner food green already set four read,1,['-']
Arrive skin east hospital. Simple election too former but. Where story degree media Z17-TBK production itself turn.,Plates,Z17-TBK,arrive skin east hospital simple election too former but where story degree media z17-tbk production itself turn,1,['-']
Go relationship development raise cold. Including other leader TV TV theory up husband. 77W824 Game to maybe series spring.,Plates,77W824,go relationship development raise cold including other leader tv tv theory up husband 77w824 game to maybe series spring,0,[]
Carry help grow able. Second yes PM daughter. Dinner us 86-I289 garden.,Plates,86-I289,carry help grow able second yes pm daughter dinner us 86-i289 garden,1,['-']
AIK 143 Piece campaign avoid item accept energy. Research father important drop. Crime wonder understand personal will doctor.,Plates,AIK 143,aik 143 piece campaign avoid item accept energy research father important drop crime wonder understand personal will doctor,0,[]
Prevent become able firm. Force look whether trouble. Opportunity 716 8PU economic how class job challenge.,Plates,716 8PU,prevent become able firm force look whether trouble opportunity 716 8pu economic how class job challenge,0,[]
Within threat air thus big beyond. Wind present for difference return. Article work he KFW 600 conference later eat.,Plates,KFW 600,within threat air thus big beyond wind present for difference return article work he kfw 600 conference later eat,0,[]
Common focus NJH9018 collection man agent. Beautiful notice successful rich.,Plates,NJH9018,common focus njh9018 collection man agent beautiful notice successful rich,0,[]
14R502 Entire determine pretty good choice water head report.,Plates,14R502,14r502 entire determine pretty good choice water head report,0,[]
Start 3786 kind civil. Attention similar threat take relationship write.,Plates,3786,start 3786 kind civil attention similar threat take relationship write,0,[]
Total would official media improve important. Tonight cultural military. Bar girl then FZG-116 record large discuss. Member southern grow happen enjoy national right.,Plates,FZG-116,total would official media improve important tonight cultural military bar girl then fzg-116 record large discuss member southern grow happen enjoy national right,1,['-']
Beat live still too. No fill order ground night why institution. Majority fight from live consumer suffer end. Across control magazine J 755958 lead.,Plates,J 755958,beat live still too no fill order ground night why institution majority fight from live consumer suffer end across control magazine j 755958 lead,0,[]
Water tend skill success ground hold. Wife instead cut. Decade south exist similar media. 4BY 918,Plates,4BY 918,water tend skill success ground hold wife instead cut decade south exist similar media 4by 918,0,[]
Best open 6AZ3415 physical brother recognize drug. Financial there position contain into. Although idea lawyer each fast only.,Plates,6AZ3415,best open 6az3415 physical brother recognize drug financial there position contain into although idea lawyer each fast only,0,[]
Kitchen use technology talk rise. Attorney without join. Land be list compare meet American. 22-OR21,Plates,22-OR21,kitchen use technology talk rise attorney without join land be list compare meet american 22-or21,1,['-']
Energy lose cultural. Maintain always stuff 63-95572 use.,Plates,63-95572,energy lose cultural maintain always stuff 63-95572 use,1,['-']
Pattern tell effort. Technology country accept. 14R502,Plates,14R502,pattern tell effort technology country accept 14r502,0,[]
Time white list else it window marriage. Popular once let GYK 773 already peace never. Nature fire deal store through. Surface fall hope maintain here rise.,Plates,GYK 773,time white list else it window marriage popular once let gyk 773 already peace never nature fire deal store through surface fall hope maintain here rise,0,[]
Stop those understand time join tell agree. Author total without YHV 725 write off look figure one. Consumer anyone produce major value single very.,Plates,YHV 725,stop those understand time join tell agree author total without yhv 725 write off look figure one consumer anyone produce major value single very,0,[]
Art allow soldier 86-I289 reveal throughout. Young meeting organization. This stage view.,Plates,86-I289,art allow soldier 86-i289 reveal throughout young meeting organization this stage view,1,['-']
Floor measure name pressure general. Son analysis somebody collection realize or Republican. 7LC 579,Plates,7LC 579,floor measure name pressure general son analysis somebody collection realize or republican 7lc 579,0,[]
Subject wish too truth skin. Smile will economic item. Read quality recognize condition ten economic home. Other source employee election 63-WB32 white sure interest.,Plates,63-WB32,subject wish too truth skin smile will economic item read quality recognize condition ten economic home other source employee election 63-wb32 white sure interest,1,['-']
Weight college all yes better 77A 909 place.,Plates,77A 909,weight college all yes better 77a 909 place,0,[]
Clearly two expect question decide special 78-A112 particularly big. When rather early newspaper still. Nation word already someone. Life culture night agent because become cause.,Plates,78-A112,clearly two expect question decide special 78-a112 particularly big when rather early newspaper still nation word already someone life culture night agent because become cause,1,['-']
Letter memory 94QI737 character. Heart professional establish later anything gas experience. Professor paper stage summer past share truth.,Plates,94QI737,letter memory 94qi737 character heart professional establish later anything gas experience professor paper stage summer past share truth,0,[]
Spend paper national answer author prepare exist. How benefit YAX5230 ball into until coach special. From baby employee real television sure.,Plates,YAX5230,spend paper national answer author prepare exist how benefit yax5230 ball into until coach special from baby employee real television sure,0,[]
Site memory spend 4061 YP relate. Worry political share should. Newspaper write she late take interesting.,Plates,4061 YP,site memory spend 4061 yp relate worry political share should newspaper write she late take interesting,0,[]
Less spring attack scientist 032-RRX drop and news. Happen soldier cost yard story. Make certainly however police.,Plates,032-RRX,less spring attack scientist 032-rrx drop and news happen soldier cost yard story make certainly however police,1,['-']
Hot generation today also. Usually south sound near ready 8KJH612 dog.,Plates,8KJH612,hot generation today also usually south sound near ready 8kjh612 dog,0,[]
Public dark soon sometimes per reason. Plan stand good LJH 586 western.,Plates,LJH 586,public dark soon sometimes per reason plan stand good ljh 586 western,0,[]
Particularly popular professional miss sit assume. Yourself 280-YHC population guy deep material form its.,Plates,280-YHC,particularly popular professional miss sit assume yourself 280-yhc population guy deep material form its,1,['-']
Loss anyone child owner run. Congress rather western front what election. Local 48-ZC01 baby would wait behind cost inside.,Plates,48-ZC01,loss anyone child owner run congress rather western front what election local 48-zc01 baby would wait behind cost inside,1,['-']
Environmental MKD 420 vote anything better career range traditional. Life rest all environmental eye national memory change. Wall artist check charge mother sort news. Never both quality produce.,Plates,MKD 420,environmental mkd 420 vote anything better career range traditional life rest all environmental eye national memory change wall artist check charge mother sort news never both quality produce,0,[]
Marriage mention red fund speech first institution protect. Care already serious fear. Name school 1DM46 fire true.,Plates,1DM46,marriage mention red fund speech first institution protect care already serious fear name school 1dm46 fire true,0,[]
Cultural Q28 9DJ share community. Go age better could cause less.,Plates,Q28 9DJ,cultural q28 9dj share community go age better could cause less,0,[]
Early quite bed need collection. Provide add data special anything collection common. Check it 3-39935L star class effort.,Plates,3-39935L,early quite bed need collection provide add data special anything collection common check it 3-39935l star class effort,1,['-']
Letter cause trouble like trade. Effort teach good 72-HY77 traditional. Magazine first discover wrong cover.,Plates,72-HY77,letter cause trouble like trade effort teach good 72-hy77 traditional magazine first discover wrong cover,1,['-']
Stand various go modern decade then modern partner. Energy term participant camera trade. 36E Q98,Plates,36E Q98,stand various go modern decade then modern partner energy term participant camera trade 36e q98,0,[]
Rich base whole firm maybe station speak. Job yet population MXV 925 travel use before. Financial off beat particular weight minute.,Plates,MXV 925,rich base whole firm maybe station speak job yet population mxv 925 travel use before financial off beat particular weight minute,0,[]
Often region join fire. Only population travel again. Term recognize behavior through. AIK 143,Plates,AIK 143,often region join fire only population travel again term recognize behavior through aik 143,0,[]
Hear image 912-PGW three like.,Plates,912-PGW,hear image 912-pgw three like,1,['-']
Could democratic FTH H89 fund kid read. Light television special treat speech west. Along cut concern want.,Plates,FTH H89,could democratic fth h89 fund kid read light television special treat speech west along cut concern want,0,[]
Both 63-WB32 employee key modern find. Walk even since.,Plates,63-WB32,both 63-wb32 employee key modern find walk even since,1,['-']
System move 57X977 seat. Do indicate citizen seven way.,Plates,57X977,system move 57x977 seat do indicate citizen seven way,0,[]
Arrive seem skill MKD 420 apply and ground. Produce really structure whole include some bar.,Plates,MKD 420,arrive seem skill mkd 420 apply and ground produce really structure whole include some bar,0,[]
Team those drop SMI Z57 wall heavy thing.,Plates,SMI Z57,team those drop smi z57 wall heavy thing,0,[]
Bag usually trial this instead. Or 93-80344 operation save former behind. Author system story night. Final newspaper offer according particularly effort.,Plates,93-80344,bag usually trial this instead or 93-80344 operation save former behind author system story night final newspaper offer according particularly effort,1,['-']
Fund lead national 86-I289 account top ahead threat. Adult accept return attention attention traditional woman.,Plates,86-I289,fund lead national 86-i289 account top ahead threat adult accept return attention attention traditional woman,1,['-']
3-39935L Project TV surface despite today. Law travel part.,Plates,3-39935L,3-39935l project tv surface despite today law travel part,1,['-']
SIQ-7599 Find generation key measure.,Plates,SIQ-7599,siq-7599 find generation key measure,1,['-']
Green structure enough feeling SDG-9831 peace hand. Article thought pull quickly book how bring himself. Voice interview picture down ahead college leg.,Plates,SDG-9831,green structure enough feeling sdg-9831 peace hand article thought pull quickly book how bring himself voice interview picture down ahead college leg,1,['-']
Style more north put news institution. 3-39935L,Plates,3-39935L,style more north put news institution 3-39935l,1,['-']
Six response whatever difficult difficult bank medical. Agency address RTW-9771 off rule society program bag perhaps.,Plates,RTW-9771,six response whatever difficult difficult bank medical agency address rtw-9771 off rule society program bag perhaps,1,['-']
Research language stock home. Social land road discussion. Stuff five west year Z87-89J admit kind poor business.,Plates,Z87-89J,research language stock home social land road discussion stuff five west year z87-89j admit kind poor business,1,['-']
Represent or stuff radio 8RZ A42 southern just. Pull material event likely. Of provide situation alone box.,Plates,8RZ A42,represent or stuff radio 8rz a42 southern just pull material event likely of provide situation alone box,0,[]
508 CLH Shoulder assume popular. Blood dream although prove bill meeting road.,Plates,508 CLH,508 clh shoulder assume popular blood dream although prove bill meeting road,0,[]
Provide contain magazine HUR-3192 along president about. Move area boy. Put marriage media ask establish. Will ago apply cup money.,Plates,HUR-3192,provide contain magazine hur-3192 along president about move area boy put marriage media ask establish will ago apply cup money,1,['-']
Somebody push person could notice result. Oil now fear give 63-WB32 special suddenly.,Plates,63-WB32,somebody push person could notice result oil now fear give 63-wb32 special suddenly,1,['-']
Half manage like truth stay common party. Law game such person we. Tax item beat HUR-3192 realize.,Plates,HUR-3192,half manage like truth stay common party law game such person we tax item beat hur-3192 realize,1,['-']
Whether shake any Democrat money. Capital understand somebody public Z78 3PD would. Too glass write north simply. Across style involve large make be natural.,Plates,Z78 3PD,whether shake any democrat money capital understand somebody public z78 3pd would too glass write north simply across style involve large make be natural,0,[]
Kitchen history example my develop. Relate knowledge manager reach resource choose carry. 53-9377V,Plates,53-9377V,kitchen history example my develop relate knowledge manager reach resource choose carry 53-9377v,1,['-']
Somebody 45V B38 never commercial respond party. Voice next skill hair happy.,Plates,45V B38,somebody 45v b38 never commercial respond party voice next skill hair happy,0,[]
Husband scientist next his top institution. Send suffer left protect American DGF 452 they realize.,Plates,DGF 452,husband scientist next his top institution send suffer left protect american dgf 452 they realize,0,[]
Series majority treatment. Certainly top 25U 583 image explain thank pull value. Start this friend lawyer.,Plates,25U 583,series majority treatment certainly top 25u 583 image explain thank pull value start this friend lawyer,0,[]
Share body available stage leader several. Loss 36E Q98 very big section any. Other performance blood amount never.,Plates,36E Q98,share body available stage leader several loss 36e q98 very big section any other performance blood amount never,0,[]
Leader CZR 622 state prove such south goal authority. Heavy baby media outside hot society break. Especially thing federal.,Plates,CZR 622,leader czr 622 state prove such south goal authority heavy baby media outside hot society break especially thing federal,0,[]
Worry hotel build wind these nothing UHZ 588 good very. Pressure partner operation education. Good use owner voice pattern fund identify.,Plates,UHZ 588,worry hotel build wind these nothing uhz 588 good very pressure partner operation education good use owner voice pattern fund identify,0,[]
0Z429 Head wonder newspaper whose case popular true. Spend next start spend better task worker.,Plates,0Z429,0z429 head wonder newspaper whose case popular true spend next start spend better task worker,0,[]
Especially allow 4I Z8677 discuss sit lot true. Boy politics despite entire forget sign international popular. Five professional early cut already race.,Plates,4I Z8677,especially allow 4i z8677 discuss sit lot true boy politics despite entire forget sign international popular five professional early cut already race,0,[]
Her approach 36E Q98 lose. Though commercial return voice. Control industry several.,Plates,36E Q98,her approach 36e q98 lose though commercial return voice control industry several,0,[]
Society number relationship amount. Mind EFC 851 space indeed gas forget policy.,Plates,EFC 851,society number relationship amount mind efc 851 space indeed gas forget policy,0,[]
Else sing agent sense. Could environmental those. 969 MGB,Plates,969 MGB,else sing agent sense could environmental those 969 mgb,0,[]
Risk effort believe BEK 053 myself.,Plates,BEK 053,risk effort believe bek 053 myself,0,[]
YMJ 426 Standard soldier even trial apply. Some market safe impact fly. Seven without project.,Plates,YMJ 426,ymj 426 standard soldier even trial apply some market safe impact fly seven without project,0,[]
Describe 2OR4539 product foot child player support four. Enjoy production eat.,Plates,2OR4539,describe 2or4539 product foot child player support four enjoy production eat,0,[]
Wrong price southern BEK 053 trial politics task apply free. Activity prevent peace six author value.,Plates,BEK 053,wrong price southern bek 053 trial politics task apply free activity prevent peace six author value,0,[]
Street go authority book gun sound. Issue something study by rather east ZWQ 873 eye. Training fund win feel camera although character.,Plates,ZWQ 873,street go authority book gun sound issue something study by rather east zwq 873 eye training fund win feel camera although character,0,[]
Measure fund realize increase research eye news. Speak television local western. 99NV1 Under entire conference serious today.,Plates,99NV1,measure fund realize increase research eye news speak television local western 99nv1 under entire conference serious today,0,[]
Various practice training open west success wife. Night indeed 6WU05 involve society public air. Opportunity off include speak long degree.,Plates,6WU05,various practice training open west success wife night indeed 6wu05 involve society public air opportunity off include speak long degree,0,[]
Chair record decide. KIR 987 Medical report many whole woman its reveal. Store rock stand decide ever against. Particular right accept policy effort good bank role.,Plates,KIR 987,chair record decide kir 987 medical report many whole woman its reveal store rock stand decide ever against particular right accept policy effort good bank role,0,[]
Mission security interview agreement 2OR4539 mean cup. Manage poor even then by billion type.,Plates,2OR4539,mission security interview agreement 2or4539 mean cup manage poor even then by billion type,0,[]
Choice she describe weight service development. Old 8KJH612 state marriage do.,Plates,8KJH612,choice she describe weight service development old 8kjh612 state marriage do,0,[]
Draw bank treat many 2CE7338 always it first both. Kid long four a whose contain hundred. Difference similar imagine daughter.,Plates,2CE7338,draw bank treat many 2ce7338 always it first both kid long four a whose contain hundred difference similar imagine daughter,0,[]
Decide four 716 8PU serious fast grow leave serious. Figure experience go she open easy chance. Member alone trip one president on head.,Plates,716 8PU,decide four 716 8pu serious fast grow leave serious figure experience go she open easy chance member alone trip one president on head,0,[]
Laugh sometimes include politics church. Able hand become natural strategy group ground. 1CQ5940,Plates,1CQ5940,laugh sometimes include politics church able hand become natural strategy group ground 1cq5940,0,[]
Method economic subject increase hundred material. One return resource they fall enough. Director fight country same suffer majority scene. LJH 586,Plates,LJH 586,method economic subject increase hundred material one return resource they fall enough director fight country same suffer majority scene ljh 586,0,[]
