Text,Labels,PII,Cleaned_text,Special_char_num,Special_chars
Suddenly 51484 Ariana Track Suite 969 about service apply just.,Address,51484 Ariana Track Suite 969,suddenly 51484 ariana track suite 969 about service apply just,0,[]
"Yourself worry as serve rate. 014 Duncan Keys Apt. 979 Pattersonberg, DC 01932 Professor interesting film center wide sometimes.",Address,"014 Duncan Keys Apt. 979 Pattersonberg, DC 01932",yourself worry as serve rate 014 duncan keys apt 979 pattersonberg dc 01932 professor interesting film center wide sometimes,0,[]
Stock enter 559 Burgess Alley Suite 358 most money. Point middle student evening likely. Political continue something as have up.,Address,559 Burgess Alley Suite 358,stock enter 559 burgess alley suite 358 most money point middle student evening likely political continue something as have up,0,[]
Mean maintain effort long. USS Stanley FPO AE 01357 Role television able sister discover.,Address,USS Stanley FPO AE 01357,mean maintain effort long uss stanley fpo ae 01357 role television able sister discover,0,[]
Level heavy remember risk certainly paper. Talk fact magazine along can do. Suite 387,Address,Suite 387,level heavy remember risk certainly paper talk fact magazine along can do suite 387,0,[]
Base new song beautiful cover. Image move Suite 399 where large new.,Address,Suite 399,base new song beautiful cover image move suite 399 where large new,0,[]
"Future alone his site stock drug again. Hotel energy 5621 Atkinson Islands Apt. 307 West Joycetown, CT 83765 since. Whatever people majority free.",Address,"5621 Atkinson Islands Apt. 307 West Joycetown, CT 83765",future alone his site stock drug again hotel energy 5621 atkinson islands apt 307 west joycetown ct 83765 since whatever people majority free,0,[]
Those in wife political individual candidate bag. Health simply maybe into collection century speech. Learn manager easy boy. Church 30428 Moore Island Apt. 034 trial foot top.,Address,30428 Moore Island Apt. 034,those in wife political individual candidate bag health simply maybe into collection century speech learn manager easy boy church 30428 moore island apt 034 trial foot top,0,[]
Hair idea positive common fill. Data room Suite 501 environment. Decade responsibility gas live now Republican reason especially.,Address,Suite 501,hair idea positive common fill data room suite 501 environment decade responsibility gas live now republican reason especially,0,[]
But phone world friend organization number white. 399 Jennifer Ferry,Address,399 Jennifer Ferry,but phone world friend organization number white 399 jennifer ferry,0,[]
"Imagine some education analysis. Man significant page animal table develop. Financial nothing help sing contain system magazine. Suddenly 82552 Mcneil Glen New Alexisberg, VA 04946 consumer city must worry so.",Address,"82552 Mcneil Glen New Alexisberg, VA 04946",imagine some education analysis man significant page animal table develop financial nothing help sing contain system magazine suddenly 82552 mcneil glen new alexisberg va 04946 consumer city must worry so,0,[]
Stand close road four environment between development risk. Require reality agreement. Room 243 Perez Junction there item perhaps suddenly spend.,Address,243 Perez Junction,stand close road four environment between development risk require reality agreement room 243 perez junction there item perhaps suddenly spend,0,[]
Suite 269 Last fire turn modern deal need whom. Its anything school.,Address,Suite 269,suite 269 last fire turn modern deal need whom its anything school,0,[]
"Me he recognize three idea. Try process all clear 75035 Andrew Lock Port Wyatt, KY 25587 treat including move. Fill feel improve term word.",Address,"75035 Andrew Lock Port Wyatt, KY 25587",me he recognize three idea try process all clear 75035 andrew lock port wyatt ky 25587 treat including move fill feel improve term word,0,[]
Protect response themselves threat. Measure store read only become fact write. Suite 269 Throw not see reveal get. Style plant many great recognize young peace.,Address,Suite 269,protect response themselves threat measure store read only become fact write suite 269 throw not see reveal get style plant many great recognize young peace,0,[]
Modern service wonder adult. Popular Suite 722 suggest place third memory address way its.,Address,Suite 722,modern service wonder adult popular suite 722 suggest place third memory address way its,0,[]
Police war control avoid risk. Candidate doctor sign. Similar Apt. 288 thus eight hit.,Address,Apt. 288,police war control avoid risk candidate doctor sign similar apt 288 thus eight hit,0,[]
Trial born draw arrive though federal. Agree at carry capital 995 Campbell Mountains actually others trouble.,Address,995 Campbell Mountains,trial born draw arrive though federal agree at carry capital 995 campbell mountains actually others trouble,0,[]
"Opportunity hair way win develop low seat. Outside 24212 Brian Courts New Charles, LA 48189 fire bar strategy. Real religious hundred. Matter later range food wear.",Address,"24212 Brian Courts New Charles, LA 48189",opportunity hair way win develop low seat outside 24212 brian courts new charles la 48189 fire bar strategy real religious hundred matter later range food wear,0,[]
"These artist article weight. Head 80927 Myers Well Suite 328 Roberthaven, AZ 51302 night million.",Address,"80927 Myers Well Suite 328 Roberthaven, AZ 51302",these artist article weight head 80927 myers well suite 328 roberthaven az 51302 night million,0,[]
"Respond 8920 Katherine Green Campbellberg, PA 52059 technology left gas off town many. State line run power sure Republican.",Address,"8920 Katherine Green Campbellberg, PA 52059",respond 8920 katherine green campbellberg pa 52059 technology left gas off town many state line run power sure republican,0,[]
Floor central set they evidence minute hard. Apt. 470 Business us recent protect safe development issue. Wife hotel strategy why not president there.,Address,Apt. 470,floor central set they evidence minute hard apt 470 business us recent protect safe development issue wife hotel strategy why not president there,0,[]
"Market miss father have hair another. Remember produce responsibility. Meet along main every over next 521 David Manor West Damon, AR 02746 bit.",Address,"521 David Manor West Damon, AR 02746",market miss father have hair another remember produce responsibility meet along main every over next 521 david manor west damon ar 02746 bit,0,[]
Suite 228 Assume beat early thing big. Fill me former knowledge maintain between.,Address,Suite 228,suite 228 assume beat early thing big fill me former knowledge maintain between,0,[]
Chance agreement Mr their owner month interview. Similar close politics return station care. Apt. 909 Although late generation town institution language pass issue. Better can teach evidence tough call people third.,Address,Apt. 909,chance agreement mr their owner month interview similar close politics return station care apt 909 although late generation town institution language pass issue better can teach evidence tough call people third,0,[]
"Size as share dinner carry. Staff personal nation sport. 4680 Contreras Grove Alyssachester, TN 24174 Score behind evidence decision nation nature.",Address,"4680 Contreras Grove Alyssachester, TN 24174",size as share dinner carry staff personal nation sport 4680 contreras grove alyssachester tn 24174 score behind evidence decision nation nature,0,[]
Stage nearly exist detail hair while enough. Every hair it rest movie huge finish. I produce expect indeed discussion. It public identify drug somebody Apt. 111 value.,Address,Apt. 111,stage nearly exist detail hair while enough every hair it rest movie huge finish i produce expect indeed discussion it public identify drug somebody apt 111 value,0,[]
"Investment attorney bed receive. Reach try school 5648 Williams Roads Sanchezmouth, ME 76535 conference pressure go. Conference personal baby car soon reflect charge. Major page experience.",Address,"5648 Williams Roads Sanchezmouth, ME 76535",investment attorney bed receive reach try school 5648 williams roads sanchezmouth me 76535 conference pressure go conference personal baby car soon reflect charge major page experience,0,[]
"Allow wall time practice. Bad yes foreign. Fact summer establish 3966 Cobb Port North Lisashire, MD 33020 wind successful of.",Address,"3966 Cobb Port North Lisashire, MD 33020",allow wall time practice bad yes foreign fact summer establish 3966 cobb port north lisashire md 33020 wind successful of,0,[]
Better improve do scene 2436 Jennifer Union worry. Get remain seem others outside.,Address,2436 Jennifer Union,better improve do scene 2436 jennifer union worry get remain seem others outside,0,[]
Price recently care central similar store indicate. School institution sure national eight keep Suite 525 subject.,Address,Suite 525,price recently care central similar store indicate school institution sure national eight keep suite 525 subject,0,[]
Allow Suite 053 action road woman. Old property street item.,Address,Suite 053,allow suite 053 action road woman old property street item,0,[]
5939 Thomas Road Apt. 813 Will perform commercial challenge. Cover general always share.,Address,5939 Thomas Road Apt. 813,5939 thomas road apt 813 will perform commercial challenge cover general always share,0,[]
Partner break room picture color share poor. Market remember second. Apt. 006,Address,Apt. 006,partner break room picture color share poor market remember second apt 006,0,[]
Draw political treat truth. Suite 399 Over direction term gun after discussion read home.,Address,Suite 399,draw political treat truth suite 399 over direction term gun after discussion read home,0,[]
"Until 3783 Duane Isle East Thomasside, IN 18855 personal story foot serious. According arrive while bed issue.",Address,"3783 Duane Isle East Thomasside, IN 18855",until 3783 duane isle east thomasside in 18855 personal story foot serious according arrive while bed issue,0,[]
"Strong prevent 62371 Allison Row East Stephanie, IL 03958 send even safe. Natural project beyond matter issue mission. Low art born since crime.",Address,"62371 Allison Row East Stephanie, IL 03958",strong prevent 62371 allison row east stephanie il 03958 send even safe natural project beyond matter issue mission low art born since crime,0,[]
Scientist character painting American 95052 Howell Pines share have mission. Money out energy cost. Magazine management get firm degree of.,Address,95052 Howell Pines,scientist character painting american 95052 howell pines share have mission money out energy cost magazine management get firm degree of,0,[]
"Suggest detail trial lead nice. Body shake 75035 Andrew Lock Port Wyatt, KY 25587 top mention control final decade.",Address,"75035 Andrew Lock Port Wyatt, KY 25587",suggest detail trial lead nice body shake 75035 andrew lock port wyatt ky 25587 top mention control final decade,0,[]
"Middle possible age require cut create toward. Participant notice study meet 776 Brian Fall Port Meganhaven, MA 17325 contain.",Address,"776 Brian Fall Port Meganhaven, MA 17325",middle possible age require cut create toward participant notice study meet 776 brian fall port meganhaven ma 17325 contain,0,[]
"Message left morning institution. Address vote wind themselves 17794 Christopher Corner Suite 718 Priceborough, IN 45531 help especially recent.",Address,"17794 Christopher Corner Suite 718 Priceborough, IN 45531",message left morning institution address vote wind themselves 17794 christopher corner suite 718 priceborough in 45531 help especially recent,0,[]
Address call professional or major ability provide. Main war method attorney can world another. Interest situation unit teacher 84903 Daniel Plain war example.,Address,84903 Daniel Plain,address call professional or major ability provide main war method attorney can world another interest situation unit teacher 84903 daniel plain war example,0,[]
Large glass blood program. Mention by Unit 3340 Box 7028 DPO AP 73887 forget figure.,Address,Unit 3340 Box 7028 DPO AP 73887,large glass blood program mention by unit 3340 box 7028 dpo ap 73887 forget figure,0,[]
"Perhaps court feeling available generation 55161 Lee Ramp Martinezhaven, NY 31844 best peace trip. Management figure short summer.",Address,"55161 Lee Ramp Martinezhaven, NY 31844",perhaps court feeling available generation 55161 lee ramp martinezhaven ny 31844 best peace trip management figure short summer,0,[]
With pay say anyone part. Suite 241 Father nor guess player popular government instead. Must pay image game movement treat research.,Address,Suite 241,with pay say anyone part suite 241 father nor guess player popular government instead must pay image game movement treat research,0,[]
Onto hand throughout financial check. Interesting 8887 Murray Isle base father growth society. Surface already what body discover campaign foreign ball.,Address,8887 Murray Isle,onto hand throughout financial check interesting 8887 murray isle base father growth society surface already what body discover campaign foreign ball,0,[]
Ball everything travel somebody majority young. Similar writer color under space decade take. Beat season buy Suite 496 available candidate.,Address,Suite 496,ball everything travel somebody majority young similar writer color under space decade take beat season buy suite 496 available candidate,0,[]
"Black performance section realize 6289 Mary Landing Apt. 138 South Selenabury, NY 98691 newspaper. Coach whether couple market minute. Different take family.",Address,"6289 Mary Landing Apt. 138 South Selenabury, NY 98691",black performance section realize 6289 mary landing apt 138 south selenabury ny 98691 newspaper coach whether couple market minute different take family,0,[]
"American action song coach discuss sign. 5392 Dalton Ports Francisbury, CT 60084 Wall music defense even.",Address,"5392 Dalton Ports Francisbury, CT 60084",american action song coach discuss sign 5392 dalton ports francisbury ct 60084 wall music defense even,0,[]
"Hard and 96303 Conley Turnpike South Jessicaport, RI 05161 memory imagine wrong.",Address,"96303 Conley Turnpike South Jessicaport, RI 05161",hard and 96303 conley turnpike south jessicaport ri 05161 memory imagine wrong,0,[]
Vote degree support will improve mouth country affect. Contain ability street. Yourself Mr Apt. 462 common study.,Address,Apt. 462,vote degree support will improve mouth country affect contain ability street yourself mr apt 462 common study,0,[]
Small way response article case score. One everybody with staff including Apt. 928 build.,Address,Apt. 928,small way response article case score one everybody with staff including apt 928 build,0,[]
Film likely plan action. Market 76716 Elizabeth Lodge Suite 531 prove shake structure.,Address,76716 Elizabeth Lodge Suite 531,film likely plan action market 76716 elizabeth lodge suite 531 prove shake structure,0,[]
Culture wind loss left adult. Interview as start prove 00940 Jordan Prairie Suite 511 everybody.,Address,00940 Jordan Prairie Suite 511,culture wind loss left adult interview as start prove 00940 jordan prairie suite 511 everybody,0,[]
Begin whether pick role amount media mother. Apt. 811 Either letter important claim blood. Hair fast remain various this notice any message.,Address,Apt. 811,begin whether pick role amount media mother apt 811 either letter important claim blood hair fast remain various this notice any message,0,[]
Mission girl answer. Type network reach. 5799 Foley Valleys Suite 597,Address,5799 Foley Valleys Suite 597,mission girl answer type network reach 5799 foley valleys suite 597,0,[]
"Simple various 89887 Arroyo Lodge South April, NE 67801 majority magazine talk dog though. Scene cup myself know over though.",Address,"89887 Arroyo Lodge South April, NE 67801",simple various 89887 arroyo lodge south april ne 67801 majority magazine talk dog though scene cup myself know over though,0,[]
Shake role account artist. Course career 479 Wood Row idea these.,Address,479 Wood Row,shake role account artist course career 479 wood row idea these,0,[]
By make style act throughout us. Focus successful fact TV campaign but. Describe do 399 Jennifer Ferry rise continue if fund carry small.,Address,399 Jennifer Ferry,by make style act throughout us focus successful fact tv campaign but describe do 399 jennifer ferry rise continue if fund carry small,0,[]
Offer standard one Apt. 561 deal. Example policy this arm land become left. Control rest common.,Address,Apt. 561,offer standard one apt 561 deal example policy this arm land become left control rest common,0,[]
Hour enough develop instead. Suite 120 Market watch imagine decision though human. Class all seek sign.,Address,Suite 120,hour enough develop instead suite 120 market watch imagine decision though human class all seek sign,0,[]
"List less however 24212 Brian Courts New Charles, LA 48189 station home. Employee network radio store discussion. Lead serve edge open particularly.",Address,"24212 Brian Courts New Charles, LA 48189",list less however 24212 brian courts new charles la 48189 station home employee network radio store discussion lead serve edge open particularly,0,[]
3973 Lisa Meadows List Congress piece rich three car. Light keep same conference. Suggest administration rock back say color mouth.,Address,3973 Lisa Meadows,3973 lisa meadows list congress piece rich three car light keep same conference suggest administration rock back say color mouth,0,[]
Soon Suite 013 sort per conference look sometimes. Enjoy sit since create finish hit suffer.,Address,Suite 013,soon suite 013 sort per conference look sometimes enjoy sit since create finish hit suffer,0,[]
Letter best Suite 289 around they painting as.,Address,Suite 289,letter best suite 289 around they painting as,0,[]
Meet already show environment best form next. Down sit view plant Apt. 734 organization occur especially.,Address,Apt. 734,meet already show environment best form next down sit view plant apt 734 organization occur especially,0,[]
"While west total grow not safe prepare. Low 80927 Myers Well Suite 328 Roberthaven, AZ 51302 war store wide. Whole big president difficult truth.",Address,"80927 Myers Well Suite 328 Roberthaven, AZ 51302",while west total grow not safe prepare low 80927 myers well suite 328 roberthaven az 51302 war store wide whole big president difficult truth,0,[]
Rich improve central subject law long. Foreign one marriage economic sometimes 2741 Tommy Lodge deep. Can music story near common.,Address,2741 Tommy Lodge,rich improve central subject law long foreign one marriage economic sometimes 2741 tommy lodge deep can music story near common,0,[]
Along newspaper ever head yeah phone free. Apt. 149,Address,Apt. 149,along newspaper ever head yeah phone free apt 149,0,[]
"Street visit purpose. Mean add policy traditional 8423 Ramos Turnpike Port Lucasville, AK 61340 include describe air. Song him responsibility draw network note out.",Address,"8423 Ramos Turnpike Port Lucasville, AK 61340",street visit purpose mean add policy traditional 8423 ramos turnpike port lucasville ak 61340 include describe air song him responsibility draw network note out,0,[]
Traditional big traditional where be. Stop page then social difficult actually worry. Game tree thus such see. Apt. 923,Address,Apt. 923,traditional big traditional where be stop page then social difficult actually worry game tree thus such see apt 923,0,[]
American letter up us. Show film oil require 2436 Jennifer Union character despite by. Provide standard account strategy partner people animal ground.,Address,2436 Jennifer Union,american letter up us show film oil require 2436 jennifer union character despite by provide standard account strategy partner people animal ground,0,[]
"Instead white 62371 Allison Row East Stephanie, IL 03958 name animal expect ready degree industry.",Address,"62371 Allison Row East Stephanie, IL 03958",instead white 62371 allison row east stephanie il 03958 name animal expect ready degree industry,0,[]
Later store American direction word simple blood. Apt. 411 International sure quality current of. Together radio daughter voice action.,Address,Apt. 411,later store american direction word simple blood apt 411 international sure quality current of together radio daughter voice action,0,[]
"Institution couple will win push process. Culture partner cultural time education. Could yard 909 Wall Ways Suite 191 South Paula, KS 95684 box change sell.",Address,"909 Wall Ways Suite 191 South Paula, KS 95684",institution couple will win push process culture partner cultural time education could yard 909 wall ways suite 191 south paula ks 95684 box change sell,0,[]
"Pressure region among. Conference adult child cost offer teacher follow. Somebody nor 26858 Murray Hills Apt. 360 Lake Anna, NY 05446 key minute. Section affect officer.",Address,"26858 Murray Hills Apt. 360 Lake Anna, NY 05446",pressure region among conference adult child cost offer teacher follow somebody nor 26858 murray hills apt 360 lake anna ny 05446 key minute section affect officer,0,[]
Smile really 307 Herrera Summit teacher attention ahead establish with main. Laugh pretty main west itself trouble trial.,Address,307 Herrera Summit,smile really 307 herrera summit teacher attention ahead establish with main laugh pretty main west itself trouble trial,0,[]
Suite 673 Contain system just me. Light sort across social. Source other also hair our. Property beautiful raise.,Address,Suite 673,suite 673 contain system just me light sort across social source other also hair our property beautiful raise,0,[]
"Girl tough common stand. Range woman even war rule material about throughout. Food little approach through newspaper 361 Christopher Rest Johnside, CO 38275 collection concern.",Address,"361 Christopher Rest Johnside, CO 38275",girl tough common stand range woman even war rule material about throughout food little approach through newspaper 361 christopher rest johnside co 38275 collection concern,0,[]
"On 9928 Valerie Branch Apt. 302 Rileytown, MN 07741 real turn check reality financial want range. Meeting night development hundred student design goal. Economy hope air question.",Address,"9928 Valerie Branch Apt. 302 Rileytown, MN 07741",on 9928 valerie branch apt 302 rileytown mn 07741 real turn check reality financial want range meeting night development hundred student design goal economy hope air question,0,[]
"Behind industry evidence remember hair 91093 Warner Road Robertchester, HI 21521 board. Child we determine style. Affect fall stand stage up. Choose call thus any rather.",Address,"91093 Warner Road Robertchester, HI 21521",behind industry evidence remember hair 91093 warner road robertchester hi 21521 board child we determine style affect fall stand stage up choose call thus any rather,0,[]
"Loss last western 4680 Contreras Grove Alyssachester, TN 24174 group concern knowledge actually.",Address,"4680 Contreras Grove Alyssachester, TN 24174",loss last western 4680 contreras grove alyssachester tn 24174 group concern knowledge actually,0,[]
Them present coach last Suite 228 could game glass. Choose since weight mother occur again against.,Address,Suite 228,them present coach last suite 228 could game glass choose since weight mother occur again against,0,[]
Significant customer list present. Into south full economic Suite 606 several art eat difficult.,Address,Suite 606,significant customer list present into south full economic suite 606 several art eat difficult,0,[]
Bill floor teach improve beyond. Realize beyond material return activity defense weight. Question spend 35910 Kristin Turnpike Suite 941 difference.,Address,35910 Kristin Turnpike Suite 941,bill floor teach improve beyond realize beyond material return activity defense weight question spend 35910 kristin turnpike suite 941 difference,0,[]
Already ago forget group station appear partner. Hand check pretty specific all. Thing author change institution. Apt. 861,Address,Apt. 861,already ago forget group station appear partner hand check pretty specific all thing author change institution apt 861,0,[]
"Special various 24212 Brian Courts New Charles, LA 48189 message past. Age also life dinner.",Address,"24212 Brian Courts New Charles, LA 48189",special various 24212 brian courts new charles la 48189 message past age also life dinner,0,[]
Cold avoid face city much. Factor time join. Huge Suite 673 walk head less send she election.,Address,Suite 673,cold avoid face city much factor time join huge suite 673 walk head less send she election,0,[]
"Whether reality whatever imagine specific. 71083 Meyer Crossroad Katrinafurt, VA 48746 Since letter sell free.",Address,"71083 Meyer Crossroad Katrinafurt, VA 48746",whether reality whatever imagine specific 71083 meyer crossroad katrinafurt va 48746 since letter sell free,0,[]
"This size consumer station. Second pass foot area themselves determine probably. Discussion seek 3773 Jonathan Centers Mindyberg, WV 95831 detail water impact partner.",Address,"3773 Jonathan Centers Mindyberg, WV 95831",this size consumer station second pass foot area themselves determine probably discussion seek 3773 jonathan centers mindyberg wv 95831 detail water impact partner,0,[]
Air 7497 Justin Fort Suite 264 thank positive pattern. Anyone dark stuff.,Address,7497 Justin Fort Suite 264,air 7497 justin fort suite 264 thank positive pattern anyone dark stuff,0,[]
Billion size war just 2773 Scott Meadows nothing political seem. Grow movement knowledge effect.,Address,2773 Scott Meadows,billion size war just 2773 scott meadows nothing political seem grow movement knowledge effect,0,[]
